{
  "$schema": "tk_ctg_substrate.schema.json",
  "schema_version": "1.0.0",
  "substrate_id": "tk:ctg:1.0.0:formal-definition",
  "metadata": {
    "title": "Tom Klootwijk Chrono-Topological-Geometric Substrate and Manifold",
    "version_date": "2026-08-22",
    "requester_attribution": {
      "name": "Tom Klootwijk",
      "identifier": "NL200678942",
      "date_string": "10-07-1990",
      "country_marker": "NL",
      "status": "requester-supplied-unverified",
      "mathematical_role": "provenance metadata only"
    },
    "formal_decision": "The named manifold is a hybrid stratified quotient state space; regular strata are smooth manifolds only when the declared gluing and transition maps satisfy the regularity conditions.",
    "evidence_boundary": "No claim of physical causation, universal compression, zero VRAM, constant-time rendering, authorship priority, patent status, identity verification or navigation-grade orbital accuracy."
  },
  "phase_schedule": [
    {
      "phase": 0,
      "id": "parse",
      "rule": "Parse literals, schemas, profiles and binary headers."
    },
    {
      "phase": 1,
      "id": "normalize",
      "rule": "Normalize units, sign conventions, dimensions and profile versions."
    },
    {
      "phase": 2,
      "id": "resolve",
      "rule": "Resolve definition references, verify SHA-256 content addresses and topologically order dependencies."
    },
    {
      "phase": 3,
      "id": "construct",
      "rule": "Construct geometric objects, addresses, seeds, charts and timeline nodes."
    },
    {
      "phase": 4,
      "id": "evolve_transform",
      "rule": "Evaluate flows/predictors and apply ordered hinges, gluing and coordinate transforms."
    },
    {
      "phase": 5,
      "id": "support",
      "rule": "Apply cheap local support predicates."
    },
    {
      "phase": 6,
      "id": "compatibility",
      "rule": "Apply sheet, route, branch, profile and policy compatibility."
    },
    {
      "phase": 7,
      "id": "guard_certify",
      "rule": "Solve or bracket relation roots and certify residual, direction, confidence and numerical margin."
    },
    {
      "phase": 8,
      "id": "transition",
      "rule": "Commit topology/mode transitions atomically; continuous field morphs do not change topology before this phase."
    },
    {
      "phase": 9,
      "id": "lineage",
      "rule": "Append ordered lineage, event records, novelty and implementation trace."
    }
  ],
  "profiles": {
    "default_ambient_dimension": 3,
    "time_domain": "declared interval or discrete monotone sample set embedded in R",
    "topology_modes": [
      "sheet",
      "orientation",
      "route",
      "branch",
      "node",
      "profile"
    ],
    "formal_class": "hybrid_stratified_quotient",
    "implementation_profiles": [
      "profile:klsc1-seedchain-v1",
      "profile:kloc1-orbit-v1"
    ],
    "optional_profiles": [
      "profile:tk7-orthogonality-v1",
      "profile:fractal-offset-v1"
    ]
  },
  "definitions": [
    {
      "id": "def:literal-definition-node-v1",
      "kind": "definition_record",
      "domain": "typed literal record",
      "codomain": "content-addressed definition",
      "evaluation_phase": 0,
      "dependencies": [],
      "parameters": {
        "hash": "SHA-256 over canonical JSON excluding content_hash"
      },
      "capabilities": [
        "referential_closure",
        "stable_id",
        "typed_domain_codomain"
      ],
      "invariants": [
        "all dependencies resolve",
        "content hash verifies"
      ],
      "provenance": {
        "class": "source-derived",
        "note": "UGTS-KC 3.6 definition node, carried into the chrono extension.",
        "source_refs": [
          "SRC-A pp.3-4"
        ]
      },
      "content_hash": "sha256:6a49bbded417fda9c4b47f6e7de00d8f597921c7d9774e1fe1f50a75f1c0cb42"
    },
    {
      "id": "schedule:tk-ctg-v1",
      "kind": "phase_schedule",
      "domain": "substrate document",
      "codomain": "ordered evaluation phases",
      "evaluation_phase": 0,
      "dependencies": [
        "def:literal-definition-node-v1"
      ],
      "parameters": {
        "phases": [
          {
            "phase": 0,
            "id": "parse",
            "rule": "Parse literals, schemas, profiles and binary headers."
          },
          {
            "phase": 1,
            "id": "normalize",
            "rule": "Normalize units, sign conventions, dimensions and profile versions."
          },
          {
            "phase": 2,
            "id": "resolve",
            "rule": "Resolve definition references, verify SHA-256 content addresses and topologically order dependencies."
          },
          {
            "phase": 3,
            "id": "construct",
            "rule": "Construct geometric objects, addresses, seeds, charts and timeline nodes."
          },
          {
            "phase": 4,
            "id": "evolve_transform",
            "rule": "Evaluate flows/predictors and apply ordered hinges, gluing and coordinate transforms."
          },
          {
            "phase": 5,
            "id": "support",
            "rule": "Apply cheap local support predicates."
          },
          {
            "phase": 6,
            "id": "compatibility",
            "rule": "Apply sheet, route, branch, profile and policy compatibility."
          },
          {
            "phase": 7,
            "id": "guard_certify",
            "rule": "Solve or bracket relation roots and certify residual, direction, confidence and numerical margin."
          },
          {
            "phase": 8,
            "id": "transition",
            "rule": "Commit topology/mode transitions atomically; continuous field morphs do not change topology before this phase."
          },
          {
            "phase": 9,
            "id": "lineage",
            "rule": "Append ordered lineage, event records, novelty and implementation trace."
          }
        ]
      },
      "capabilities": [
        "deterministic_order",
        "phase_barrier"
      ],
      "invariants": [
        "dependencies sort within phases",
        "transition follows certified guard"
      ],
      "provenance": {
        "class": "engineering",
        "note": "Ten-phase schedule extending the UGTS order with explicit chrono wording.",
        "source_refs": [
          "SRC-A pp.9-10",
          "SRC-D docs/SEEDCHAIN_DEPLOYMENT.md",
          "SRC-D docs/ORBIT_DEPLOYMENT.md"
        ]
      },
      "content_hash": "sha256:90e9e2620fee19ebd90821ae099d5a3a72148560e3f74095e832a8a4e3d8383c"
    },
    {
      "id": "state:tk-hybrid-v1",
      "kind": "hybrid_state",
      "domain": "address x time x mode x geometric jet x auxiliary x lineage",
      "codomain": "typed state",
      "evaluation_phase": 1,
      "dependencies": [
        "def:literal-definition-node-v1"
      ],
      "parameters": {
        "tuple": "(a,t,q,xi,eta,ell)"
      },
      "capabilities": [
        "coordinates_not_identity",
        "kinematic_state",
        "mode_state"
      ],
      "invariants": [
        "address nonempty",
        "mode declared",
        "coordinate dimension matches profile"
      ],
      "provenance": {
        "class": "engineering",
        "note": "Separates durable identity, chronology, continuous geometry and discrete topology.",
        "source_refs": [
          "SRC-A pp.3,5,9",
          "SRC-D docs/ARCHITECTURE_MAPPING.md"
        ]
      },
      "content_hash": "sha256:e26ebc43a265c318adb12759474995a7b37b3a627046c7cad6ca8fd2abea0c83"
    },
    {
      "id": "geom:implicit-sign-v1",
      "kind": "implicit_field",
      "domain": "M_q",
      "codomain": "real scalar",
      "evaluation_phase": 1,
      "dependencies": [
        "def:literal-definition-node-v1"
      ],
      "parameters": {
        "sign": "f<0 interior; f=0 boundary/event; f>0 exterior"
      },
      "capabilities": [
        "inside_outside_sign",
        "zero_level_set"
      ],
      "invariants": [
        "finite evaluation on declared domain"
      ],
      "provenance": {
        "class": "source-derived",
        "note": "Literal implicit-field sign convention.",
        "source_refs": [
          "SRC-A p.4",
          "SRC-C pp.5-8"
        ]
      },
      "content_hash": "sha256:ce613b1b13c0f9958b4b4ad9e2d8872fb9e6a86e375377d0f8bd9f6f360c33d1"
    },
    {
      "id": "geom:exact-sdf-capability-v1",
      "kind": "capability_guard",
      "domain": "implicit field",
      "codomain": "boolean capability",
      "evaluation_phase": 1,
      "dependencies": [
        "geom:implicit-sign-v1"
      ],
      "parameters": {
        "criterion": "distance semantics must be proved/declared; |grad f|=1 where differentiable is a diagnostic, not a universal guarantee"
      },
      "capabilities": [
        "exact_distance_flag"
      ],
      "invariants": [
        "generic implicit field is not automatically exact SDF"
      ],
      "provenance": {
        "class": "corrected",
        "note": "Corrects source dialogue claims that SDF notation alone supplies exact distance or smoothness.",
        "source_refs": [
          "SRC-A pp.2,4,13",
          "SRC-B pp.12-14",
          "SRC-C pp.5-8"
        ]
      },
      "content_hash": "sha256:1f6b17497555bc5de75e2e65fcb7c2d8d6b2646bb45e73b422448e751789a785"
    },
    {
      "id": "topo:explicit-gluing-v1",
      "kind": "quotient_gluing",
      "domain": "named boundary ports x topology state",
      "codomain": "transported coordinate and topology state",
      "evaluation_phase": 1,
      "dependencies": [
        "state:tk-hybrid-v1"
      ],
      "parameters": {
        "record": "(entry_port,exit_port,coordinate_map,orientation_map,sheet_update,lineage_update)"
      },
      "capabilities": [
        "explicit_ports",
        "orientation_transport",
        "sheet_transport"
      ],
      "invariants": [